{
  "schema_version": 2,
  "certification": {
    "provider": "AWS",
    "code": "EXAMPLE-C01",
    "name": "Synthetic example certification"
  },
  "source": {
    "key": "synthetic-example-2026",
    "name": "Synthetic example",
    "type": "synthetic",
    "observed_year": 2026,
    "verified_year": 2026,
    "verification_status": "verified_current"
  },
  "classification": {
    "origin": "curated_from_source_content",
    "fields": [
      "area",
      "topic"
    ]
  },
  "questions": [
    {
      "source_ref": "1",
      "question": "Which fictional service is the correct answer in this synthetic example?",
      "type": "single_select",
      "select_count": 1,
      "classification": {
        "area": "Synthetic area",
        "topic": "Synthetic topic"
      },
      "answers": [
        {
          "text": "Wrong Example",
          "correct": false,
          "rationale": "Synthetic distractor."
        },
        {
          "text": "Right Example",
          "correct": true,
          "rationale": "Synthetic correct answer."
        }
      ]
    }
  ]
}
